{
  "$schema": "https://json-schema.org/draft/2020-12/schema",
  "$id": "https://otsec.local/contracts/event/0.1/event.json",
  "title": "otsec.event/0.1",
  "description": "C4 event. Rules that need more than one field (precision against resolution, UTC equals wall clock minus offset, hashes against bytes, span inside evidence, category needs a mapping, origin-dependent fields) are enforced by event.Validate in Go; this schema states structure only. Not strict: readers ignore unknown fields.",
  "type": "object",
  "required": ["schema", "id", "origin", "kind", "source", "received"],
  "properties": {
    "schema": {"type": "string", "pattern": "^otsec\\.event/0\\.(0|[1-9][0-9]{0,3})$"},
    "id": {"$ref": "#/$defs/event_id"},
    "origin": {"enum": ["device", "platform"]},
    "kind": {"$ref": "#/$defs/token", "description": "Open set: ser, soe-log, device-log, syslog, host-event, device-status, telemetry-health."},
    "source": {
      "type": "object",
      "required": ["origin_auth"],
      "properties": {
        "asset": {
          "type": "object",
          "required": ["id", "binding"],
          "properties": {
            "id": {"type": "string", "pattern": "^[0-9a-f]{8}-[0-9a-f]{4}-[1-8][0-9a-f]{3}-[89ab][0-9a-f]{3}-[0-9a-f]{12}$", "description": "C1 asset ID, a lowercase UUID. TODO(C1)."},
            "binding": {
              "type": "object",
              "required": ["method", "confidence"],
              "properties": {
                "method": {"enum": ["adapter-target", "sender-address", "content-field", "operator"]},
                "confidence": {"enum": ["configured", "asserted", "inferred"]}
              }
            }
          }
        },
        "sender": {
          "type": "object",
          "required": ["address"],
          "properties": {
            "address": {"type": "string", "minLength": 1},
            "asset_id": {"type": "string"}
          }
        },
        "origin_auth": {"enum": ["none", "tls-server-only", "tls-mutual", "session", "platform"]}
      }
    },
    "collection": {
      "type": "object",
      "required": ["method", "parse_status"],
      "properties": {
        "method": {"enum": ["adapter-poll", "syslog-receive", "host-push"]},
        "invocation_id": {"type": "string", "description": "Required for adapter-poll (Go rule)."},
        "operation_id": {"type": "string", "description": "TODO(C3): C3 operation ID."},
        "parser": {
          "type": "object",
          "required": ["name", "version"],
          "properties": {"name": {"type": "string", "minLength": 1}, "version": {"type": "string", "minLength": 1}}
        },
        "native_position": {"type": "string"},
        "alignment": {"enum": ["first-read", "ok", "gap-before", "possible-duplicate"]},
        "parse_status": {"enum": ["ok", "partial", "failed"]}
      }
    },
    "received": {
      "type": "object",
      "required": ["utc", "resolution_ns", "clock"],
      "properties": {
        "utc": {"$ref": "#/$defs/utc"},
        "resolution_ns": {"type": "integer", "minimum": 1},
        "clock": {
          "type": "object",
          "required": ["sync"],
          "properties": {"sync": {"$ref": "#/$defs/sync"}, "source": {"type": "string"}}
        }
      }
    },
    "device_time": {
      "type": "object",
      "required": ["native", "native_encoding", "format", "wall_clock", "offset", "offset_basis", "resolution_ns"],
      "properties": {
        "native": {"type": "string", "minLength": 1},
        "native_encoding": {"enum": ["text", "hex"]},
        "format": {"$ref": "#/$defs/token"},
        "wall_clock": {"type": "string", "pattern": "^\\d{4}-\\d{2}-\\d{2}T\\d{2}:\\d{2}:\\d{2}(\\.\\d{1,9})?$"},
        "offset": {"type": "string", "pattern": "^(unknown|[+-](0\\d|1[0-4]):[0-5]\\d)$"},
        "offset_basis": {"enum": ["none", "on-wire", "format-utc", "device-setting", "operator"]},
        "utc": {"$ref": "#/$defs/utc"},
        "resolution_ns": {"type": "integer", "minimum": 1},
        "accuracy_ns": {"type": "integer", "minimum": 1},
        "quality": {
          "type": "object",
          "required": ["sync", "scope"],
          "properties": {
            "time_source": {"type": "string"},
            "sync": {"$ref": "#/$defs/sync"},
            "leap_seconds_known": {"type": "boolean"},
            "clock_failure": {"type": "boolean"},
            "accuracy_relative_ns": {"type": "integer", "minimum": 1},
            "scope": {"enum": ["record", "report", "device", "stream"]}
          }
        },
        "flags": {"type": "array", "items": {"$ref": "#/$defs/flag"}}
      }
    },
    "native": {
      "type": "object",
      "required": ["record_sha256", "record_length", "evidence"],
      "properties": {
        "bytes": {"type": "string", "contentEncoding": "base64"},
        "record_sha256": {"$ref": "#/$defs/sha256"},
        "record_length": {"type": "integer", "minimum": 0},
        "evidence": {
          "type": "object",
          "required": ["sha256", "length"],
          "properties": {
            "sha256": {"$ref": "#/$defs/sha256"},
            "length": {"type": "integer", "minimum": 0},
            "ref": {"type": "string", "pattern": "^sha256:[0-9a-f]{64}$", "description": "C5 capture name; equals \"sha256:\" + sha256 (Go rule)."}
          }
        },
        "span": {"$ref": "#/$defs/span"},
        "context_span": {"$ref": "#/$defs/span"},
        "alignment_key": {"type": "string", "pattern": "^sha256:[0-9a-f]{64}$"},
        "fields": {
          "type": "array",
          "items": {
            "type": "object",
            "required": ["name", "value"],
            "properties": {"name": {"type": "string", "minLength": 1}, "value": {"type": "string"}}
          }
        }
      }
    },
    "normalized": {
      "type": "object",
      "required": ["subject", "subject_type", "value", "category"],
      "properties": {
        "subject": {"type": "string"},
        "subject_type": {"type": "string"},
        "value": {"type": "string"},
        "category": {"type": "string", "minLength": 1, "description": "\"unmapped\" unless mapping names the table that assigned it."},
        "mapping": {
          "type": "object",
          "required": ["table", "version"],
          "properties": {"table": {"type": "string", "minLength": 1}, "version": {"type": "string", "minLength": 1}}
        }
      }
    },
    "health": {
      "type": "object",
      "required": ["type"],
      "properties": {
        "type": {"$ref": "#/$defs/token", "description": "Open set: ser.gap, ser.alignment-ambiguous, native.loss-indicated, time.unsynchronized, parse.failed, source.silent, intake.drop-counted, forward.unconfirmed, forward.unreachable, forward.text-omitted."},
        "related": {"type": "array", "items": {"$ref": "#/$defs/event_id"}},
        "details": {"type": "object", "additionalProperties": {"type": "string"}}
      }
    },
    "flags": {"type": "array", "items": {"$ref": "#/$defs/flag"}}
  },
  "$defs": {
    "event_id": {
      "type": "object",
      "required": ["node_id", "stream", "seq"],
      "properties": {
        "node_id": {"type": "string", "pattern": "^[a-z0-9]([a-z0-9-]{0,61}[a-z0-9])?$"},
        "stream": {"type": "string", "pattern": "^[a-z0-9][a-z0-9._/-]{0,127}$"},
        "seq": {"type": "integer", "minimum": 1}
      }
    },
    "token": {"type": "string", "pattern": "^[a-z][a-z0-9.-]{0,63}$"},
    "flag": {"type": "string", "pattern": "^[a-z][a-z0-9.-]{0,63}(:[^\\u0000\\n\\r]*)?$"},
    "utc": {"type": "string", "pattern": "^\\d{4}-\\d{2}-\\d{2}T\\d{2}:\\d{2}:\\d{2}(\\.\\d{1,9})?Z$"},
    "sync": {"enum": ["synchronized", "unsynchronized", "unknown"]},
    "sha256": {"type": "string", "pattern": "^[0-9a-f]{64}$"},
    "span": {
      "type": "object",
      "required": ["offset", "length"],
      "properties": {"offset": {"type": "integer", "minimum": 0}, "length": {"type": "integer", "minimum": 0}}
    }
  }
}
