{
  "schema": "otsec.event/0.1",
  "id": {
    "node_id": "site-a-node1",
    "stream": "sel751-feeder1/ser",
    "seq": 2
  },
  "origin": "device",
  "kind": "ser",
  "source": {
    "asset": {
      "id": "2b7d4e10-8c3f-4a5b-9e21-7c4f0d6a8b13",
      "binding": {
        "method": "adapter-target",
        "confidence": "configured"
      }
    },
    "origin_auth": "session",
    "evidence_class": "simulated"
  },
  "collection": {
    "method": "adapter-poll",
    "invocation_id": "0f3e6c1a-8b2d-4e7f-9a15-6c4d2b8e0a71",
    "operation_id": "sel.ser.read_all",
    "parser": {
      "name": "sel-ascii-ser",
      "version": "0.1"
    },
    "native_position": "7",
    "alignment": "first-read",
    "parse_status": "ok"
  },
  "received": {
    "utc": "2026-10-24T12:00:05.123456Z",
    "resolution_ns": 1000,
    "clock": {
      "sync": "synchronized",
      "source": "w32time"
    }
  },
  "device_time": {
    "native": "02/28/2007 13:54:09.602",
    "native_encoding": "text",
    "format": "sel-ascii-ser-row",
    "wall_clock": "2007-02-28T13:54:09.602",
    "offset": "unknown",
    "offset_basis": "none",
    "resolution_ns": 1000000,
    "quality": {
      "time_source": "Internal",
      "sync": "unknown",
      "accuracy_relative_ns": 1000000,
      "scope": "report"
    },
    "flags": [
      "date-format-assumed:MDY"
    ]
  },
  "native": {
    "bytes": "NyAgICAgMDIvMjgvMjAwNyAgIDEzOjU0OjA5LjYwMiAgIDUxQVAgICAgICAgICAgICAgICAgICAgICBBc3NlcnRlZA==",
    "record_sha256": "53415080faa3afbf5958484ec9c1c4b7dc8760055f7f2c28915f9d765d9923ed",
    "record_length": 67,
    "evidence": {
      "sha256": "006c5eba0418a185507dd7def360a2dc618f9334439141220ba737c5c081a8bf",
      "length": 879,
      "ref": "sha256:006c5eba0418a185507dd7def360a2dc618f9334439141220ba737c5c081a8bf"
    },
    "span": {
      "offset": 392,
      "length": 67
    },
    "context_span": {
      "offset": 18,
      "length": 236
    },
    "alignment_key": "sha256:82cb472bff263d8dfa1b5812bbd62fa85f3ac3fb309ea7a51d60ae2647989163",
    "fields": [
      {
        "name": "#",
        "value": "7"
      },
      {
        "name": "DATE",
        "value": "02/28/2007"
      },
      {
        "name": "TIME",
        "value": "13:54:09.602"
      },
      {
        "name": "ELEMENT",
        "value": "51AP"
      },
      {
        "name": "STATE",
        "value": "Asserted"
      }
    ]
  },
  "normalized": {
    "subject": "51AP",
    "subject_type": "ser-element",
    "value": "Asserted",
    "category": "unmapped"
  }
}
