{
  "schema": "otsec.event/0.1",
  "id": {
    "node_id": "site-a-node1",
    "stream": "sel751-feeder1/ser",
    "seq": 8
  },
  "origin": "device",
  "kind": "ser",
  "source": {
    "asset": {
      "id": "2b7d4e10-8c3f-4a5b-9e21-7c4f0d6a8b13",
      "binding": {
        "method": "adapter-target",
        "confidence": "configured"
      }
    },
    "origin_auth": "session"
  },
  "collection": {
    "method": "adapter-poll",
    "invocation_id": "0f3e6c1a-8b2d-4e7f-9a15-6c4d2b8e0a71",
    "operation_id": "sel.ser.read_all",
    "parser": {
      "name": "sel-ascii-ser",
      "version": "0.1"
    },
    "native_position": "1",
    "alignment": "first-read",
    "parse_status": "ok"
  },
  "received": {
    "utc": "2026-10-24T12:00:05.123456Z",
    "resolution_ns": 1000,
    "clock": {
      "sync": "synchronized",
      "source": "w32time"
    }
  },
  "device_time": {
    "native": "02/28/2007 13:54:10.511",
    "native_encoding": "text",
    "format": "sel-ascii-ser-row",
    "wall_clock": "2007-02-28T13:54:10.511",
    "offset": "unknown",
    "offset_basis": "none",
    "resolution_ns": 1000000,
    "quality": {
      "time_source": "Internal",
      "sync": "unknown",
      "accuracy_relative_ns": 1000000,
      "scope": "report"
    },
    "flags": [
      "date-format-assumed:MDY"
    ]
  },
  "native": {
    "bytes": "MSAgICAgMDIvMjgvMjAwNyAgIDEzOjU0OjEwLjUxMSAgIFRSSVAgICAgICAgICAgICAgICAgICAgICBEZWFzc2VydGVk",
    "record_sha256": "1fdf02521670bf916e02004105d8dfefecd188b9ab983ead88eadcde04c23d1c",
    "record_length": 69,
    "evidence": {
      "sha256": "006c5eba0418a185507dd7def360a2dc618f9334439141220ba737c5c081a8bf",
      "length": 879,
      "ref": "sha256:006c5eba0418a185507dd7def360a2dc618f9334439141220ba737c5c081a8bf"
    },
    "span": {
      "offset": 806,
      "length": 69
    },
    "context_span": {
      "offset": 18,
      "length": 236
    },
    "alignment_key": "sha256:35cd52b2d5f9259811a66656691b2acf30b81d80b46821150f542d6cc9559e96",
    "fields": [
      {
        "name": "#",
        "value": "1"
      },
      {
        "name": "DATE",
        "value": "02/28/2007"
      },
      {
        "name": "TIME",
        "value": "13:54:10.511"
      },
      {
        "name": "ELEMENT",
        "value": "TRIP"
      },
      {
        "name": "STATE",
        "value": "Deasserted"
      }
    ]
  },
  "normalized": {
    "subject": "TRIP",
    "subject_type": "ser-element",
    "value": "Deasserted",
    "category": "unmapped"
  }
}
