{
  "schema": "otsec.event/0.1",
  "id": {
    "node_id": "site-a-node1",
    "stream": "sel751-feeder1/ser",
    "seq": 1
  },
  "origin": "device",
  "kind": "ser",
  "source": {
    "asset": {
      "id": "2b7d4e10-8c3f-4a5b-9e21-7c4f0d6a8b13",
      "binding": {
        "method": "adapter-target",
        "confidence": "configured"
      }
    },
    "origin_auth": "session",
    "evidence_class": "simulated"
  },
  "collection": {
    "method": "adapter-poll",
    "invocation_id": "0f3e6c1a-8b2d-4e7f-9a15-6c4d2b8e0a71",
    "operation_id": "sel.ser.read_all",
    "parser": {
      "name": "sel-ascii-ser",
      "version": "0.1"
    },
    "native_position": "8",
    "alignment": "first-read",
    "parse_status": "ok"
  },
  "received": {
    "utc": "2026-10-24T12:00:05.123456Z",
    "resolution_ns": 1000,
    "clock": {
      "sync": "synchronized",
      "source": "w32time"
    }
  },
  "device_time": {
    "native": "02/28/2007 13:54:09.602",
    "native_encoding": "text",
    "format": "sel-ascii-ser-row",
    "wall_clock": "2007-02-28T13:54:09.602",
    "offset": "-08:00",
    "offset_basis": "device-setting",
    "resolution_ns": 1000000,
    "quality": {
      "time_source": "Internal",
      "sync": "unknown",
      "accuracy_relative_ns": 1000000,
      "scope": "report"
    },
    "flags": [],
    "utc": "2007-02-28T21:54:09.602Z"
  },
  "native": {
    "bytes": "OCAgICAgMDIvMjgvMjAwNyAgIDEzOjU0OjA5LjYwMiAgIDUxUDFQICAgICAgICAgICAgICAgICAgICBBc3NlcnRlZA==",
    "record_sha256": "17a3967c69ba758a4fb272c18c57b1391c59e381e4536237d759ec058acecbfd",
    "record_length": 67,
    "evidence": {
      "sha256": "006c5eba0418a185507dd7def360a2dc618f9334439141220ba737c5c081a8bf",
      "length": 879,
      "ref": "sha256:006c5eba0418a185507dd7def360a2dc618f9334439141220ba737c5c081a8bf"
    },
    "span": {
      "offset": 324,
      "length": 67
    },
    "context_span": {
      "offset": 18,
      "length": 236
    },
    "alignment_key": "sha256:1caaf49fb21226069b72cc6efeff83e0b95f1331da18ac854b3f9d7ff6b69ed7",
    "fields": [
      {
        "name": "#",
        "value": "8"
      },
      {
        "name": "DATE",
        "value": "02/28/2007"
      },
      {
        "name": "TIME",
        "value": "13:54:09.602"
      },
      {
        "name": "ELEMENT",
        "value": "51P1P"
      },
      {
        "name": "STATE",
        "value": "Asserted"
      }
    ]
  },
  "normalized": {
    "subject": "51P1P",
    "subject_type": "ser-element",
    "value": "Asserted",
    "category": "unmapped"
  }
}
